{
  "$schema": "https://json-schema.org/draft/2020-12/schema",
  "$id": "urn:nigson:event:order.paid.v1",
  "type": "object",
  "properties": {
    "event_id": {
      "type": "string",
      "format": "uuid",
      "pattern": "^(?!00000000-0000-0000-0000-000000000000$)[0-9a-fA-F]{8}-[0-9a-fA-F]{4}-[0-9a-fA-F]{4}-[0-9a-fA-F]{4}-[0-9a-fA-F]{12}$"
    },
    "event_type": {
      "const": "order.paid.v1"
    },
    "schema_version": {
      "const": 1
    },
    "producer": {
      "enum": [
        "commerce"
      ]
    },
    "occurred_at": {
      "type": "string",
      "format": "date-time",
      "maxLength": 40,
      "pattern": "^\\d{4}-\\d{2}-\\d{2}T\\d{2}:\\d{2}:\\d{2}(\\.\\d{1,9})?(Z|\\+00:00)$"
    },
    "aggregate_id": {
      "type": "string",
      "format": "uuid",
      "pattern": "^(?!00000000-0000-0000-0000-000000000000$)[0-9a-fA-F]{8}-[0-9a-fA-F]{4}-[0-9a-fA-F]{4}-[0-9a-fA-F]{4}-[0-9a-fA-F]{12}$"
    },
    "aggregate_version": {
      "type": "integer",
      "minimum": 0,
      "maximum": 9223372036854775807
    },
    "organization_id": {
      "anyOf": [
        {
          "type": "string",
          "format": "uuid",
          "pattern": "^(?!00000000-0000-0000-0000-000000000000$)[0-9a-fA-F]{8}-[0-9a-fA-F]{4}-[0-9a-fA-F]{4}-[0-9a-fA-F]{4}-[0-9a-fA-F]{12}$"
        },
        {
          "type": "null"
        }
      ]
    },
    "correlation_id": {
      "type": "string",
      "format": "uuid",
      "pattern": "^(?!00000000-0000-0000-0000-000000000000$)[0-9a-fA-F]{8}-[0-9a-fA-F]{4}-[0-9a-fA-F]{4}-[0-9a-fA-F]{4}-[0-9a-fA-F]{12}$"
    },
    "traceparent": {
      "anyOf": [
        {
          "type": "string",
          "pattern": "^00-(?!0{32}-)[a-f0-9]{32}-(?!0{16}-)[a-f0-9]{16}-[a-f0-9]{2}$"
        },
        {
          "type": "null"
        }
      ]
    },
    "payload": {
      "type": "object",
      "properties": {
        "order_id": {
          "type": "string",
          "format": "uuid",
          "pattern": "^(?!00000000-0000-0000-0000-000000000000$)[0-9a-fA-F]{8}-[0-9a-fA-F]{4}-[0-9a-fA-F]{4}-[0-9a-fA-F]{4}-[0-9a-fA-F]{12}$"
        },
        "party_id": {
          "type": "string",
          "format": "uuid",
          "pattern": "^(?!00000000-0000-0000-0000-000000000000$)[0-9a-fA-F]{8}-[0-9a-fA-F]{4}-[0-9a-fA-F]{4}-[0-9a-fA-F]{4}-[0-9a-fA-F]{12}$"
        },
        "organization_id": {
          "anyOf": [
            {
              "type": "string",
              "format": "uuid",
              "pattern": "^(?!00000000-0000-0000-0000-000000000000$)[0-9a-fA-F]{8}-[0-9a-fA-F]{4}-[0-9a-fA-F]{4}-[0-9a-fA-F]{4}-[0-9a-fA-F]{12}$"
            },
            {
              "type": "null"
            }
          ]
        },
        "currency": {
          "type": "string",
          "pattern": "^[A-Z]{3}$"
        },
        "total": {
          "type": "string",
          "pattern": "^-?\\d{1,15}(\\.\\d{1,4})?$"
        },
        "payment_transaction_id": {
          "type": "string",
          "format": "uuid",
          "pattern": "^(?!00000000-0000-0000-0000-000000000000$)[0-9a-fA-F]{8}-[0-9a-fA-F]{4}-[0-9a-fA-F]{4}-[0-9a-fA-F]{4}-[0-9a-fA-F]{12}$"
        }
      },
      "required": [
        "order_id",
        "party_id",
        "organization_id",
        "currency",
        "total",
        "payment_transaction_id"
      ],
      "additionalProperties": false
    }
  },
  "required": [
    "event_id",
    "event_type",
    "schema_version",
    "producer",
    "occurred_at",
    "aggregate_id",
    "aggregate_version",
    "organization_id",
    "correlation_id",
    "traceparent",
    "payload"
  ],
  "additionalProperties": false
}
